{
  "$schema": "https://json-schema.org/draft/2020-12/schema",
  "$id": "https://github.com/Imrsv-tools/Matter-Library/tools/converters/recipe.schema.json",
  "title": "Matter Library article recipe",
  "description": "One JSON recipe per article (tools/converters/recipes/<Stem>.json). The assembler (assemble_mtlx.py) turns it into the .mtlx; nobody hand-writes MaterialX. Checked by the `recipe` lane of run_all.py (validate_recipe.py), which also checks what a schema cannot: the taxonomy (G3), path agreement (G5), physical plausibility (G6) and the layer assignment (G7). Every property here must be a MaterialSpec field or one of the metadata keys (_comment, path, class, sources); the lane checks that too, so this file cannot drift from the assembler.",
  "type": "object",
  "additionalProperties": false,
  "required": ["name", "path", "master", "domain", "class", "scale_tag", "meters_per_tile", "lcd_ports", "contributor"],
  "properties": {
    "_comment": {"type": "string", "description": "Why this master, what the article is for."},
    "status": {"type": "string", "enum": ["draft", "candidate", "approved", "deprecated", "retired"], "description": "The article's lifecycle state before a release (Phase07, D-S): missing = draft. candidate = passed USDLiveView and Blender in the parity rig; approved = Unreal agrees too. Never written into the .mtlx; a release's own status lives in its lockfile."},
    "label": {"type": "string", "minLength": 1, "maxLength": 60, "description": "Phase13 13.2: the name a person reads, where the one derived from the tokens reads badly (SiteFile.md §label). Confirmed by the maintainer with the picture. Never in the .mtlx."},
    "summary": {"type": "string", "minLength": 10, "maxLength": 160, "description": "Phase13 13.2: one plain public line saying what the material is and where it is found. Written by the agent at build time, confirmed by the maintainer with the picture (F-MP-14). Never in the .mtlx."},
    "search_words": {"type": "array", "minItems": 1, "items": {"type": "string", "pattern": "^[a-z0-9%][a-z0-9% .-]*$"}, "description": "Phase13 13.2: lowercase words a search should find the material by, synonyms included (\"steel\" finds stainless steel). Never in the .mtlx."},
    "origin": {"type": "array", "minItems": 1, "items": {"type": "string", "enum": ["scan", "procedural", "measured", "agent-drafted"]}, "description": "Phase13 13.2 (F-MP-18): where the article came from: a scanned source (scan), a generator (procedural), measured values (measured), and an agent drafting the recipe (agent-drafted). Never in the .mtlx."},
    "name": {"type": "string", "pattern": "^[A-Za-z0-9_]{1,63}$", "description": "The stem: Material_Variant_Condition_Detail_sNN_vNN (Identity.md)."},
    "path": {"type": "string", "pattern": "^[a-z]+/[a-z]+(/[a-z]+)?/[A-Za-z0-9_]+\\.mtlx$", "description": "<domain>/<class>/<name>.mtlx under MatterLibrary/materials/; a Character article's is character/<species>/<part>/<name>.mtlx (Phase15, RD-P15-8)."},
    "group": {"type": "string", "enum": ["matter", "character"], "description": "Phase15 (RD-P15-3): the group the article is browsed in, written into its imrsv_metadata. Absent = matter, so a Matter recipe never needs it. Never derived from the domain (F-DS-5)."},
    "species": {"type": "string", "enum": ["humanoid"], "description": "Phase15: a Character article's species (tools/converters/groups.py). Character only."},
    "part": {"type": "string", "enum": ["eyes", "hair", "skin", "nails", "teeth", "mouth"], "description": "Phase15 (RD-P15-1): a Character article's part, one of its species' rows (tools/converters/groups.py). Character only."},
    "contributor": {"type": "string", "minLength": 1, "maxLength": 64, "description": "Phase16 (RD-P16-6, RD-P16-11): who brought the article into the library, as a handle, written into its imrsv_metadata. Required. The library's own articles say \"MatterBot\". A courtesy and for tracking, never a licence condition (RD-RO-2): the licence is CC0-1.0 library-wide, a constant in the assembler and never a recipe field."},
    "fits": {"type": "string", "enum": ["MakeHuman_Body_v01", "MakeHuman_Eyes_v01", "MakeHuman_Teeth_v01", "MakeHuman_Tongue_v01"], "description": "Phase18 (RD-P18-1, RD-P18-2): the part mesh a fitted Character article's picture is drawn for, named <Family>_<Mesh>_vNN, a version being a UV layout (tools/converters/groups.py PART_MESHES; its kit: tools/converters/fit/make_kits.py). Written into imrsv_metadata. Comes with base_color_map_tex."},
    "master": {"type": "string", "enum": ["Opaque", "Masked", "TranslucentThin", "TranslucentThick", "Subsurface", "TwoLayer", "Emissive", "Hair", "system"]},
    "domain": {"type": "string", "enum": ["natural", "engineered", "synthetic", "environmental", "utility", "biological"]},
    "class": {"type": "string", "description": "A class of the domain in Taxonomy.md (checked by G3)."},
    "scale_tag": {"type": "string", "enum": ["s0001", "s001", "s01", "s1", "s10", "s100", "sUKN"]},
    "meters_per_tile": {"type": "number", "minimum": 0},

    "base_color_tex": {"type": "string"},
    "roughness_tex": {"type": "string"},
    "normal_tex": {"type": "string"},
    "metalness_tex": {"type": "string"},
    "base_color_const": {"$ref": "#/$defs/color3"},
    "roughness_const": {"type": "number"},
    "metalness_const": {"type": "number"},
    "specular_ior": {"type": "number"},
    "specular_weight": {"type": "number", "minimum": 0, "maximum": 1, "description": "OpenPBR's own input (lane A; Phase09 9.1): the specular lobe's weight, authored only when set. Card hair sets 0: matte, since a highlight across a card reads as a flat sheet (the lead at Phase09 click 1)."},
    "transmission": {"type": "number"},
    "emission_color": {"$ref": "#/$defs/color3"},
    "emission_luminance": {"type": "number", "minimum": 0},

    "opacity_tex": {"type": "string"},
    "transmission_color": {"$ref": "#/$defs/color3"},
    "transmission_depth": {"type": "number", "minimum": 0},
    "thin_walled": {"type": "boolean"},
    "subsurface_weight": {"type": "number"},
    "subsurface_color": {"$ref": "#/$defs/color3"},
    "subsurface_radius": {"type": "number", "minimum": 0},
    "subsurface_radius_scale": {"$ref": "#/$defs/color3"},
    "subsurface_scatter_anisotropy": {"type": "number", "description": "OpenPBR, -1..1: > 0 scatters forward (skin ~0.8). Blender honours 0..1 only (random-walk methods)."},
    "coat_weight": {"type": "number", "description": "OpenPBR coat (lane A; Phase07). Authored only when set."},
    "coat_color": {"$ref": "#/$defs/color3"},
    "coat_roughness": {"type": "number"},
    "coat_ior": {"type": "number"},
    "fuzz_weight": {"type": "number", "description": "OpenPBR fuzz (lane A; Phase07): a fine grazing-angle sheen. Blender's Sheen."},
    "fuzz_color": {"$ref": "#/$defs/color3"},
    "fuzz_roughness": {"type": "number"},
    "specular_roughness_anisotropy": {"type": "number", "minimum": 0, "maximum": 1, "description": "OpenPBR's own input (lane A, carrier C3, Phase07 7.6): the highlight stretched along the mesh's UV tangent (U). Hair: strands run along V."},

    "opacity_cutoff": {"type": "number"},
    "cutout_map": {"type": "boolean", "description": "Masked and Hair (Phase07 7.6, L2; Phase08 8.1): the article declares the cutout_map input, the mesh's own cut-out supplied when the article is bound (LCDSchema §Cut-out map). Masked needs opacity_cutoff (a hard cut-out); Hair refuses it (soft coverage). Excludes opacity_tex."},
    "base_color_map": {"type": "boolean", "description": "Opaque, Masked, Hair and Subsurface (Phase09 9.1, RD-P09-1): the article declares the base_color_map input, the mesh's own picture (a hairstyle's strands, an eye) supplied when the article is bound (LCDSchema §Base colour map), multiplied into the base colour before the tint and sampled on the mesh's own UVs, outside place2d. Empty, it reads white: the article's own colour."},
    "base_color_map_tex": {"type": "string", "description": "Phase18 (RD-P18-9): a fitted Character article's OWN picture for its base_color_map input, a path relative to the article's folder, drawn on the UV layout of the part mesh `fits` names. Needs base_color_map and fits. The recipe gate (G8) checks it against that layout: a square sRGB RGB PNG at the mesh's map size, covering every UV island. A binding may still supply its own picture (the Carrier rule)."},
    "layer_blend_balance": {"type": "number"},
    "layer_blend_contrast": {"type": "number"},
    "layer2_base_color_tex": {"type": "string"},
    "layer2_roughness_tex": {"type": "string"},
    "layer2_metalness_tex": {"type": "string"},
    "layer2_normal_tex": {"type": "string"},
    "layer2_base_color": {"$ref": "#/$defs/color3"},
    "layer2_roughness": {"type": "number"},
    "layer2_metalness": {"type": "number"},

    "overlays": {
      "type": "array",
      "description": "Shared wear layers, overlay 1 first (overlay 1 = the damage layer). The cap is MAX_OVERLAYS in assemble_mtlx.py (checked by G7, never written here).",
      "items": {
        "type": "object",
        "additionalProperties": false,
        "required": ["texture", "density_port"],
        "properties": {
          "texture": {"type": "string"},
          "density_port": {"type": "string", "enum": ["overlay1_density", "overlay2_density", "overlay3_density"]},
          "color_port": {"type": "string", "enum": ["overlay1_color", "overlay2_color", "overlay3_color"], "description": "Phase10: makes the overlay a DEPOSIT (dust) that covers the surface in this port's colour; the same slot as density_port, and listed in lcd_ports."}
        }
      }
    },
    "maskset_tex": {"type": "string"},
    "lcd_ports": {
      "type": "array",
      "items": {"type": "string", "enum": ["base_color_tint", "uv_scale", "uv_offset", "uv_rotation", "overlay1_density", "overlay2_density", "overlay3_density", "maskset_blend", "roughness_bias", "overlay1_color", "overlay2_color", "overlay3_color", "transmission_color", "emission_color", "emission_luminance"]}
    },
    "lcd_defaults": {
      "type": "object",
      "additionalProperties": false,
      "properties": {
        "base_color_tint": {"$ref": "#/$defs/color3"},
        "uv_scale": {"type": "string"},
        "uv_offset": {"type": "string"},
        "uv_rotation": {"type": "string"},
        "overlay1_density": {"type": "string"},
        "overlay2_density": {"type": "string"},
        "overlay3_density": {"type": "string"},
        "maskset_blend": {"type": "string"},
        "roughness_bias": {"type": "string"},
        "overlay1_color": {"$ref": "#/$defs/color3"},
        "overlay2_color": {"$ref": "#/$defs/color3"},
        "overlay3_color": {"$ref": "#/$defs/color3"}
      }
    },
    "include_metadata": {"type": "boolean"},

    "sources": {
      "type": "array",
      "description": "Where the grounded values came from (research O6): a Physically Based record from lookup_physically_based.py, or {kind: judgement, why}.",
      "items": {
        "type": "object",
        "required": ["kind"],
        "properties": {"kind": {"type": "string", "enum": ["physicallybased", "judgement", "ambientcg", "procedural"]}}
      }
    }
  },
  "$defs": {
    "color3": {"type": "string", "pattern": "^\\s*-?[0-9.]+(e-?[0-9]+)?\\s*,\\s*-?[0-9.]+(e-?[0-9]+)?\\s*,\\s*-?[0-9.]+(e-?[0-9]+)?\\s*$", "description": "\"r, g, b\" in linear sRGB (lin_rec709)."}
  }
}
