{
  "label": "Scale grid 10 m (diagnostic)",
  "summary": "A grid with a 10 m tile, to check a model's UVs are at real size. Lines at 10 m, 1 m, 10 cm and 1 cm; each length is one colour in every grid.",
  "search_words": [
    "scale grid",
    "scale test",
    "10 m",
    "uv scale",
    "real size",
    "diagnostic",
    "debug"
  ],
  "origin": [
    "procedural",
    "agent-drafted"
  ],
  "_comment": "Phase19 19.1 scale grid (RD-SP-1 to RD-SP-4). Base color = gen_scalegrid.py: a line's colour is its length in every grid, the background a dark shade of the tile's own colour, four line levels, the finest dim. meters_per_tile is exactly the tag (RD-P19-2). Master Opaque, as the UV grid's; matte so a highlight cannot hide a line.",
  "name": "Diagnostic_ScaleGrid_Clean_Base_s10_v01",
  "contributor": "MatterBot",
  "path": "utility/virtual/Diagnostic_ScaleGrid_Clean_Base_s10_v01.mtlx",
  "master": "Opaque",
  "domain": "utility",
  "class": "virtual",
  "scale_tag": "s10",
  "meters_per_tile": 10.0,
  "base_color_tex": "../../../textures/base/utility/virtual/ScaleGrid_basecolor_s10.png",
  "roughness_const": 0.8,
  "metalness_const": 0.0,
  "specular_ior": 1.5,
  "lcd_ports": [
    "base_color_tint",
    "uv_scale",
    "uv_offset",
    "uv_rotation"
  ]
}
