{
  "label": "Polished veined marble",
  "summary": "Pale polished marble with soft veins, glowing faintly where light gets into the stone.",
  "search_words": ["marble", "stone", "polished stone", "countertop", "tile", "rock"],
  "origin": ["procedural", "agent-drafted"],
  "_comment": "Phase 71 example article — SUBSURFACE. The defining observable is LIGHT BLEEDING THROUGH: the stone glows softly where it is thin. Maps stay pale and low-contrast so the SCATTER is what you see, not the albedo. `subsurface_weight` must be nonzero — the master multiplies the scatter colour by it (default 0 = plain opaque stone). `subsurface_radius` is the length scale in cm; `_radius_scale` is the per-channel MFP (red travels furthest in stone, hence the warm falloff). Routes by the `marble` leaf-stem name exception (class stone -> Opaque otherwise). ** radius 0.6 -> 1.5 (71.12 smoke): the bleed was real but far too faint to read. The master approximates SSS as `SubsurfaceColor * saturate(RadiusScale * Radius) * Subsurface` -- UE legacy SSS has no mean-free-path input, so scatter MAGNITUDE is the only lever. At radius 0.6 that evaluated to ~(0.47,0.28,0.19): present, but a faint blush. At 1.5 the red channel saturates and it lands ~(0.78,0.70,0.47) -- visibly bleeding, warm falloff preserved. This is tuning the APPROXIMATION, not correcting a physical constant. Legacy SSS only really reads with light BEHIND the mesh. ** ** 2026-09-27 (Phase05 5.4, F13; lead: \"fix marble\"): radius 1.5 -> 0.0085. OpenPBR's `subsurface_radius` is in SCENE units, which are metres here, so 1.5 meant 1.5 m of scattering: light passed through the whole object and the veins washed out in a path tracer (the parity rig, Blender Cycles). 0.0085 m is the red-channel scattering distance derived from Jensen et al. 2001's measured marble coefficients (sigma_a 0.0021/0.0041/0.0071, sigma_s' 2.19/2.62/3.00 per mm; 1/sqrt(3 sigma_a sigma_t') gives ~8.5/5.6/4.0 mm), quoted from memory at the time and not re-checked against the paper; `_radius_scale` (1.0, 0.62, 0.44) already matched those ratios and is kept. The 0.6 -> 1.5 tuning above fudged the article to suit a consumer's approximation, which MasterSet's opacity-floor rule forbids: the article states its physics, and a master that cannot show it is the defect. **",
  "name": "Marble_Veined_Polished_Base_s01_v01",
  "contributor": "MatterBot",
  "path": "natural/stone/Marble_Veined_Polished_Base_s01_v01.mtlx",
  "master": "Subsurface",
  "domain": "natural",
  "class": "stone",
  "scale_tag": "s01",
  "meters_per_tile": 0.5,
  "base_color_tex": "../../../textures/base/natural/stone/Marble_Veined_basecolor_s01.png",
  "roughness_tex": "../../../textures/base/natural/stone/Marble_Veined_roughness_s01.png",
  "normal_tex": "../../../textures/base/natural/stone/Marble_Veined_normal_s01.png",
  "metalness_const": 0.0,
  "specular_ior": 1.486,
  "subsurface_weight": 0.85,
  "subsurface_color": "0.92, 0.88, 0.84",
  "subsurface_radius": 0.0085,
  "subsurface_radius_scale": "1.0, 0.62, 0.44",
  "lcd_ports": ["base_color_tint", "uv_scale", "uv_offset", "uv_rotation", "roughness_bias"]
}
