{
  "label": "Polished nephrite jade",
  "summary": "Leaf-green nephrite jade polished to a soft, waxy lustre.",
  "search_words": ["jade", "nephrite", "stone", "gem", "green", "carving"],
  "origin": ["procedural", "agent-drafted"],
  "_comment": "Polished nephrite jade: a felted mass of fine amphibole fibres, polished to a soft, waxy lustre; a medium leaf-green, cloudy rather than banded, with paler and deeper green clouds, a faint fibrous streak and the odd black speck. SUBSURFACE: jade's look is light getting into it, a few millimetres, green travelling furthest. subsurface_color is ONE constant, the texture's mean linear albedo (the library cannot drive a textured article's scatter colour from its texture), so at subsurface_weight 0.6 the clouds keep about 40 % of their contrast. Base textures are generated (L2, tools/converters/base/gen_nephritejade_polished.py), as the wish list plans: ambientCG has no jade asset. Carries every relevant wear layer at 0 (C1): scratches (overlay 1, damage), dust as a deposit (Phase10), water spots, gated by the Crevice mask. Built by the Phase11 batch.",
  "name": "NephriteJade_Polished_Clean_Base_s01_v01",
  "contributor": "MatterBot",
  "status": "draft",
  "path": "natural/stone/NephriteJade_Polished_Clean_Base_s01_v01.mtlx",
  "master": "Subsurface",
  "domain": "natural",
  "class": "stone",
  "scale_tag": "s01",
  "meters_per_tile": 0.1,
  "base_color_tex": "../../../textures/base/natural/stone/NephriteJade_Polished_basecolor_s01.png",
  "roughness_tex": "../../../textures/base/natural/stone/NephriteJade_Polished_roughness_s01.png",
  "normal_tex": "../../../textures/base/natural/stone/NephriteJade_Polished_normal_s01.png",
  "metalness_const": 0.0,
  "specular_ior": 1.61,
  "subsurface_weight": 0.6,
  "subsurface_color": "0.055, 0.14, 0.065",
  "subsurface_radius": 0.004,
  "subsurface_radius_scale": "0.45, 1.0, 0.55",
  "maskset_tex": "../../../textures/shared/masks/Crevice01_s01.png",
  "overlays": [
    {"texture": "../../../textures/shared/overlays/Scratches01_overlay_s001.png", "density_port": "overlay1_density"},
    {"texture": "../../../textures/shared/overlays/Dust01_overlay_s001.png", "density_port": "overlay2_density", "color_port": "overlay2_color"},
    {"texture": "../../../textures/shared/overlays/WaterSpots01_overlay_s01.png", "density_port": "overlay3_density"}
  ],
  "lcd_ports": ["base_color_tint", "uv_scale", "uv_offset", "uv_rotation", "overlay1_density", "overlay2_density", "overlay3_density", "maskset_blend", "roughness_bias", "overlay2_color"],
  "sources": [
    {"kind": "judgement", "why": "Mean linear albedo (0.055, 0.14, 0.065), about sRGB 66, 105, 72, for a medium-green nephrite; roughness about 0.14 for jade's waxy polish; specular_ior 1.61 (nephrite about 1.60-1.63); subsurface_weight 0.6, subsurface_color the mean albedo, subsurface_radius 0.004 m with green travelling furthest (0.45, 1.0, 0.55): jade is translucent a few millimetres in. Physically Based has no jade entry."},
    {"kind": "procedural", "script": "tools/converters/base/gen_nephritejade_polished.py", "provenance": "library/provenance/sources/base/natural/stone/NephriteJade_Polished.yaml"}
  ]
}
