{
  "summary": "Silver buffed to a bright, cool white mirror, as on cutlery, jewellery, trays and trophies.",
  "search_words": ["silver", "polished silver", "sterling silver", "metal", "shiny", "precious metal", "silverware", "jewellery", "jewelry"],
  "origin": ["measured", "agent-drafted"],
  "_comment": "Polished silver: silver freshly buffed, with no tarnish, the metal of cutlery, jewellery, trays and trophies (most of it sterling, 92.5% silver, 7.5% copper, whose polished face looks the same). Named Silver, not SterlingSilver, in line with the library's metals (Gold, Copper, Brass: the plain matter name; maintainer, 2026-10-19). Opaque, param-only: a solid metal with no texture of its own at this scale; the finish is the roughness. Base colour from Physically Based 'Silver'. APPROXIMATE: OpenPBR's metal edge tint (specular_color, the F82 tint) and the complex IOR are not carried by the library (F-LC-6). Tarnish (the yellow-to-black sulphide film silver grows in air) is not carried: the library has no tarnish layer. Carries every relevant wear layer at 0 (C1): hairline scratches (overlay 1, damage), dust as a deposit (Phase10), fingerprints, gated by the Edges mask (its B channel is the broad corner band meant for a deposit, its A the open faces meant for handling marks, so dust takes slot 2 and fingerprints slot 3). Built by the Phase11 batch.",
  "name": "Silver_Polished_Clean_Base_s01_v01",
  "status": "candidate",
  "contributor": "MatterBot",
  "path": "engineered/metal/Silver_Polished_Clean_Base_s01_v01.mtlx",
  "master": "Opaque",
  "domain": "engineered",
  "class": "metal",
  "scale_tag": "s01",
  "meters_per_tile": 0.1,
  "base_color_const": "0.991, 0.985, 0.974",
  "roughness_const": 0.08,
  "metalness_const": 1,
  "maskset_tex": "../../../textures/shared/masks/Edges01_s01.png",
  "overlays": [
    {"texture": "../../../textures/shared/overlays/HairlineScratches01_overlay_s001.png", "density_port": "overlay1_density"},
    {"texture": "../../../textures/shared/overlays/Dust01_overlay_s001.png", "density_port": "overlay2_density", "color_port": "overlay2_color"},
    {"texture": "../../../textures/shared/overlays/Fingerprints01_overlay_s01.png", "density_port": "overlay3_density"}
  ],
  "lcd_ports": ["base_color_tint", "uv_scale", "uv_offset", "uv_rotation", "overlay1_density", "overlay2_density", "overlay3_density", "maskset_blend", "roughness_bias", "overlay2_color"],
  "sources": [
    {"kind": "physicallybased", "entry": "Silver", "api": "https://api.physicallybased.info/v2/materials", "schema_version": 2.2, "updated": 202610110901, "license": "CC0 1.0 Universal",
     "used": {"base_color_const": "0.991, 0.985, 0.974", "metalness_const": 1, "roughness_const": 0},
     "not_carried": ["specularColor", "complexIor"],
     "note": "roughness_const is not taken (the entry is an ideal mirror); the polish is the judgement below."},
    {"kind": "judgement", "why": "roughness 0.08 for a buffed polish: a sharp but not perfect mirror (a real polished face keeps a faint micro-haze), as on the polished gold article."}
  ]
}
