{
  "summary": "Near-black satin cast iron with a fine cast grain, as on a seasoned pan or a stove grate.",
  "search_words": ["cast iron", "iron", "metal", "cookware", "dark metal"],
  "origin": ["scan", "measured", "agent-drafted"],
  "_comment": "Cast iron as cookware and stove hardware: the near-black, satin surface of a seasoned pan, a stove grate, hooks and hinges, with a fine cast grain and small pits. Opaque, a conductor, from an ambientCG scan (L3, Metal052C) grounded on Physically Based `Cast Iron`: the scan's bright bare-iron albedo is tinted onto that entry's colour by the authored base_color_tint, and its metalness and roughness maps are kept. A bare, machined iron is a later sibling. APPROXIMATE: no metal edge tint (F82 specular_color) or complex IOR (F-LC-6). Carries every relevant wear layer at 0 (C1): scratches (overlay 1, damage), pitting (overlay 2, corrosion pits), dust as a deposit (Phase10), gated by the Grime mask, as on MildSteel_Raw. Drafted by /matter-generate for the Kitchen_set look; Storm only, not rigged.",
  "name": "CastIron_Raw_Clean_Base_s01_v01",
  "contributor": "MatterBot",
  "status": "draft",
  "path": "engineered/metal/CastIron_Raw_Clean_Base_s01_v01.mtlx",
  "master": "Opaque",
  "domain": "engineered",
  "class": "metal",
  "scale_tag": "s01",
  "meters_per_tile": 0.1,
  "base_color_tex": "../../../textures/base/engineered/metal/CastIron_Raw_basecolor_s01.png",
  "roughness_tex": "../../../textures/base/engineered/metal/CastIron_Raw_roughness_s01.png",
  "metalness_tex": "../../../textures/base/engineered/metal/CastIron_Raw_metalness_s01.png",
  "normal_tex": "../../../textures/base/engineered/metal/CastIron_Raw_normal_s01.png",
  "maskset_tex": "../../../textures/shared/masks/Grime01_s01.png",
  "overlays": [
    {
      "texture": "../../../textures/shared/overlays/Scratches01_overlay_s001.png",
      "density_port": "overlay1_density"
    },
    {
      "texture": "../../../textures/shared/overlays/Pitting01_overlay_s001.png",
      "density_port": "overlay2_density"
    },
    {
      "texture": "../../../textures/shared/overlays/Dust01_overlay_s001.png",
      "density_port": "overlay3_density",
      "color_port": "overlay3_color"
    }
  ],
  "lcd_defaults": {
    "base_color_tint": "0.0525, 0.0491, 0.0493"
  },
  "lcd_ports": [
    "base_color_tint",
    "uv_scale",
    "uv_offset",
    "uv_rotation",
    "overlay1_density",
    "overlay2_density",
    "overlay3_density",
    "maskset_blend",
    "roughness_bias",
    "overlay3_color"
  ],
  "sources": [
    {
      "kind": "ambientcg",
      "asset": "Metal052C",
      "url": "https://ambientcg.com/view?id=Metal052C",
      "license": "CC0-1.0",
      "provenance": "library/provenance/sources/base/engineered/metal/CastIron_Raw.yaml"
    },
    {
      "kind": "physicallybased",
      "entry": "Cast Iron",
      "api": "https://api.physicallybased.info/v2/materials",
      "schema_version": 2.2,
      "updated": 202609302132,
      "license": "CC0 1.0 Universal",
      "used": {
        "base_color_const": "0.027, 0.026, 0.026",
        "metalness_const": 1,
        "roughness_const": 0.3,
        "specular_ior": 1.5
      },
      "note": "the scan's mean linear albedo (0.514, 0.530, 0.528) is tinted onto this entry's colour by the authored base_color_tint; its metalness map (mean ~0.99) and roughness map (mean ~0.37) are kept"
    },
    {
      "kind": "judgement",
      "why": "ambientCG gives no physical size for Metal052C; a 0.1 m tile puts its pits at ~1 mm, a cast surface's grain."
    }
  ]
}
