{
  "summary": "Smooth grey concrete, worn and dusty, with scratches and dust you can turn up or down.",
  "search_words": ["concrete", "cement", "worn", "dusty", "floor", "wall"],
  "origin": ["scan", "agent-drafted"],
  "_comment": "Proof article 3 — layered/overlay. Opaque master + 2 overlays (shared dust + scratches). ambientCG CC0 (Concrete034) base. Exercises overlay1/2_density + tint/UV/roughness_bias. New (engineered/cementitious per Taxonomy.md). Phase 71 (71.11): repointed at the regenerated PACKED-DATA overlays (R/G = normal XY, B = roughness bias, A = mask density) — they were albedo bitmaps, and the `_basecolor_` in their old filenames was the tell.",
  "name": "Concrete_Smooth_Worn_Dusty_s1_v01",
  "contributor": "MatterBot",
  "path": "engineered/cementitious/Concrete_Smooth_Worn_Dusty_s1_v01.mtlx",
  "master": "Opaque",
  "domain": "engineered",
  "class": "cementitious",
  "scale_tag": "s1",
  "meters_per_tile": 1.0,
  "base_color_tex": "../../../textures/base/engineered/cementitious/Concrete_Smooth_Worn_basecolor_s1.png",
  "roughness_tex": "../../../textures/base/engineered/cementitious/Concrete_Smooth_Worn_roughness_s1.png",
  "normal_tex": "../../../textures/base/engineered/cementitious/Concrete_Smooth_Worn_normal_s1.png",
  "metalness_const": 0.0,
  "specular_ior": 1.5,
  "overlays": [
    {"texture": "../../../textures/shared/overlays/Dust01_overlay_s001.png", "density_port": "overlay1_density", "color_port": "overlay1_color"},
    {"texture": "../../../textures/shared/overlays/Scratches01_overlay_s01.png", "density_port": "overlay2_density"}
  ],
  "lcd_ports": ["base_color_tint", "uv_scale", "uv_offset", "uv_rotation", "overlay1_density", "overlay2_density", "roughness_bias", "overlay1_color"]
}
